hearing_congress,hearing_chamber,hearing_committee_id,hearing_date,hearing_description
117.0,senate,SSEG,2021-06-17,Hearings to examine the President&#39;s proposed budget request for fiscal year 2022 for the U.S. Forest Service.
117.0,senate,SSEG,2021-06-16,"Hearings to examine S.173, to provide for the designation of certain wilderness areas, recreation management areas, and conservation areas in the State of Colorado, S.177, to amend the John D. Dingell, Jr. Conservation, Management, and Recreation Act to establish the Cerro de la Olla Wilderness in the Rio Grande del Norte National Monument and to modify the boundary of the Rio Grande del Norte National Monument, S.182, to withdraw certain Federal land in the Pecos Watershed area of the State of New Mexico from mineral entry, S.455, to designate and expand wilderness areas in Olympic National Forest in the State of Washington, and to designate certain rivers in Olympic National Forest and Olympic National Park as wild and scenic rivers, S.554, to require the Secretary of Agriculture to conduct a study on the establishment of, and the potential land that could be included in, a unit of the National Forest System in the State of Hawaii, S.567, to provide for conservation and economic development in the State of Nevada, S.569, to direct the Secretary of Agriculture to transfer certain National Forest System land to the State of South Dakota, S.609, to withdraw the National Forest System land in the Ruby Mountains subdistrict of the Humboldt-Toiyabe National Forest and the National Wildlife Refuge System land in Ruby Lake National Wildlife Refuge, Elko and White Pine Counties, Nevada, from operation under the mineral leasing laws, S.904, to require the Secretary of the Interior, the Secretary of Agriculture, and the Assistant Secretary of the Army for Civil Works to digitize and make publicly available geographic information system mapping data relating to public access to Federal land and waters for outdoor recreation, S.1008, to require the Secretary of the Interior to develop a modeling tool, conduct a study, and issue reports relating to the tax equivalent amount of payments under the payment in lieu of taxes program, S.1076, to amend the Energy Policy Act of 2005 to require the Secretary of the Interior to establish a program to plug, remediate, and reclaim orphaned oil and gas wells and surrounding land, to provide funds to State and Tribal government to plug, remediate, and reclaim orphaned oil and gas wells and surrounding land, S.1128, to provide for the continuation of higher education through the conveyance to the University of Alaska of certain public land in the State of Alaska, S.1222, to designate and adjust certain lands in the State of Utah as components of the National Wilderness Preservation System, and S.1686, to amend the Wilderness Act to allow local Federal officials to determine the manner in which nonmotorized uses may be permitted in wilderness areas."
117.0,senate,SSEG,2021-06-15,Hearings to examine the President&#39;s proposed budget request for fiscal year 2022 for the Department of Energy.
117.0,senate,SSEG,2021-06-08,"Hearings to examine the nominations of Tracy Stone-Manning, of Montana, to be Director of the Bureau of Land Management, Department of the Interior, and Shalanda H. Baker, of Texas, to be Director of the Office of Minority Economic Impact, Samuel T. Walsh, of New York, to be General Counsel, and Andrew Eilperin Light, of Georgia, to be an Assistant Secretary (International Affairs), all of the Department of Energy."
117.0,senate,SSHR,2022-09-21,"Business meeting to consider the nominations of Karla Ann Gilbride, of Maryland, to be General Counsel of the Equal Employment Opportunity Commission, Jessica Looman, of Minnesota, to be Administrator of the Wage and Hour Division, Department of Labor, Moshe Z. Marvit, of Pennsylvania, to be a Member of the Federal Mine Safety and Health Review Commission, and other pending calendar business."
117.0,senate,SSHR,2022-09-14,"Hearings to examinestopping the spread of monkeypox, focusing on the Federal response."
117.0,senate,SSHR,2022-09-13,"Hearings to examine the nominations of Karla Ann Gilbride, of Maryland, to be General Counsel of the Equal Employment Opportunity Commission, and Jessica Looman, of Minnesota, to be Administrator of the Wage and Hour Division, Department of Labor."
117.0,senate,SSHR,2022-07-26,"Hearings to examinefighting fentanyl, focusing on the Federal response to a growing crisis."
117.0,senate,SSHR,2022-07-13,"Hearings to examine reproductive care in a post-&lt;em&gt;Roe &lt;/em&gt;America, focusing on barriers, challenges, and threats to women&#39;s health."
117.0,senate,SSHR,2022-06-22,"Hearings to examinesupporting students and schools, focusing on promising practices to get back on track."
117.0,senate,SSHR,2022-06-16,"Hearings to examinean update on the ongoing Federal response to COVID-19, focusing on current status and future planning."
117.0,senate,SSHR,2022-06-14,"Business meeting to consider S.4348, to amend the Federal Food, Drug, and Cosmetic Act to revise and extend the user-fee programs for prescription drugs, medical devices, generic drugs, and biosimilar biological products, S.958, to amend the Public Health Service Act to expand the allowable use criteria for new access points grants for community health centers, S.4353, to amend the Employee Retirement Income Security Act of 1974 and the Internal Revenue Code of 1986 to improve retirement plan provisions, H.R.1193, to amend title IV of the Public Health Service Act to direct the Director of the National Institutes of Health, in consultation with the Director of the National Heart, Lung, and Blood Institute, to establish a program under which the Director of the National Institutes of Health shall support or conduct research on valvular heart disease, S.4052, to reauthorize a program for early detection, diagnosis, and treatment regarding deaf and hard-of-hearing newborns, infants, and young children, and other pending calendar business."
117.0,senate,SSHR,2022-06-08,"Business meeting to consider S.4348, to amend the Federal Food, Drug, and Cosmetic Act to revise and extend the user-fee programs for prescription drugs, medical devices, generic drugs, and biosimilar biological products, S.958, to amend the Public Health Service Act to expand the allowable use criteria for new access points grants for community health centers, and other pending calendar business."
117.0,senate,SSHR,2022-05-26,"Hearings to examineinfant formula crisis, focusing on addressing the shortage and getting formula on shelves."
117.0,senate,SSHR,2022-05-25,"Business meeting to consider the nominations of Kalpana Kotagal, of Ohio, to be a Member of the Equal Employment Opportunity Commission, LaWanda Amaker Toney, of Maryland, to be Assistant Secretary for Communications and Outreach, and Nasser H. Paydar, of Indiana, to be Assistant Secretary for Postsecondary Education, both of the Department of Education, Rita M. Landgraf, of Delaware, to be Assistant Secretary for Aging, Department of Health and Human Services, and other pending calendar business."
117.0,senate,SSHR,2022-05-25,"Business meeting to consider the nominations of Kalpana Kotagal, of Ohio, to be a Member of the Equal Employment Opportunity Commission, LaWanda Amaker Toney, of Maryland, to be Assistant Secretary for Communications and Outreach, and Nasser H. Paydar, of Indiana, to be Assistant Secretary for Postsecondary Education, both of the Department of Education, Rita M. Landgraf, of Delaware, to be Assistant Secretary for Aging, Department of Health and Human Services, and other pending calendar business."
117.0,senate,SSHR,2022-05-18,Hearings to examinecybersecurity in the health and education sectors.
117.0,senate,SSHR,2022-05-10,"Hearings to examine the nomination of Kalpana Kotagal, of Ohio, to be a Member of the Equal Employment Opportunity Commission."
117.0,senate,SSHR,2022-05-03,"Hearings to examineconnecting workers and communities, focusing on preparing and supporting the broadband workforce."
117.0,senate,SSHR,2022-04-26,"Hearings to examineFDA user fee agreements, focusing on advancing medical product regulation and innovation for the benefit of patients and FDA Center Directors."
117.0,senate,SSHR,2022-04-05,"Hearings to examineFDA user fee agreements, focusing on advancing medical product regulation and innovation for the benefit of patients."
117.0,senate,SSHR,2022-04-05,"Hearings to examineFDA user fee agreements, focusing on advancing medical product regulation and innovation for the benefit of patients."
117.0,senate,SSHR,2022-03-29,Hearings to examineimproving retirement and enhancing savings.
117.0,senate,SSHR,2022-03-29,Hearings to examineimproving retirement and enhancing savings .
117.0,senate,SSHR,2022-03-23,"Hearings to examinestrengthening Federal mental health and substance use disorder programs, focusing on opportunities, challenges, and emerging issues."
117.0,senate,SSHR,2022-03-22,"Hearings to examinechild care and preschool, focusing on cutting costs for working families."
117.0,senate,SSHR,2022-03-22,"Hearings to examinechild care and preschool, focusing on cutting costs for working families."
117.0,senate,SSHR,2022-03-15,"Business meeting to consider S.3799, to prepare for, and respond to, existing viruses, emerging new threats, and pandemics, and other pending calendar business."
117.0,senate,SSHR,2022-02-15,Hearings to examinesupporting quality workforce development opportunities and innovation to address barriers to employment.
117.0,senate,SSHR,2022-02-10,"Business meeting to consider the nominations of Glenna Laureen Wright-Gallo, of Nevada, to be Assistant Secretary for Special Education and Rehabilitative Services, Department of Education, Christopher John Williamson, of West Virginia, to be Assistant Secretary of Labor for Mine Safety and Health, Mary Lucille Jordan, of Maryland, and Timothy Baker, of Virginia, both to be a Member of the Federal Mine Safety and Health Review Commission, and other pending calendar business."
117.0,senate,SSHR,2022-02-10,"Hearings to examine the health care workforce shortage, focusing onrecruiting, revitalizing and diversifying."
117.0,senate,SSHR,2022-02-10,"Business meeting to consider the nominations of Glenna Laureen Wright-Gallo, of Nevada, to be Assistant Secretary for Special Education and Rehabilitative Services, Department of Education, Christopher John Williamson, of West Virginia, to be Assistant Secretary of Labor for Mine Safety and Health, Mary Lucille Jordan, of Maryland, and Timothy Baker, of Virginia, both to be a Member of the Federal Mine Safety and Health Review Commission, and other pending calendar business."
117.0,senate,SSHR,2022-02-09,"Business meeting to consider the nominations of Glenna Laureen Wright-Gallo, of Nevada, to be Assistant Secretary for Special Education and Rehabilitative Services, Department of Education, Christopher John Williamson, of West Virginia, to be Assistant Secretary of Labor for Mine Safety and Health, Mary Lucille Jordan, of Maryland, and Timothy Baker, of Virginia, both to be a Member of the Federal Mine Safety and Health Review Commission, and other pending calendar business."
117.0,senate,SSHR,2022-02-08,"Hearings to examinelessons learned from COVID-19, focusing on highlighting innovations, maximizing inclusive practices, and overcoming barriers to employment for people with disabilities."
117.0,senate,SSHR,2022-02-01,"Hearings to examine mental health and substance use disorders, focusing on responding to the growing crisis."
117.0,senate,SSHR,2022-02-01,"Hearings to examine mental health and substance use disorders, focusing on responding to the growing crisis."
117.0,senate,SSHR,2022-01-13,"Business meeting to consider the nominations of Robert McKinnon Califf, of North Carolina, to be Commissioner of Food and Drugs, Department of Health and Human Services, Jose Javier Rodriguez, of Florida, and Lisa M. Gomez, of New Jersey, both to be an Assistant Secretary, and David Weil, of Massachusetts, to be Administrator of the Wage and Hour Division, all of the Department of Labor, Amy Loyd, of New Mexico, to be Assistant Secretary for Career, Technical, and Adult Education, Department of Education, Javier Ramirez, of Illinois, to be Federal Mediation and Conciliation Director, Linda A. Puchala, of Maryland, to be Member of the National Mediation Board, andSusan Harthill, of Maryland, to be a Member of the Occupational Safety and Health Review Commission."
117.0,senate,SSHR,2022-01-13,"Business meeting to consider the nominations of Robert McKinnon Califf, of North Carolina, to be Commissioner of Food and Drugs, Department of Health and Human Services, Jose Javier Rodriguez, of Florida, and Lisa M. Gomez, of New Jersey, both to be an Assistant Secretary, and David Weil, of Massachusetts, to be Administrator of the Wage and Hour Division, all of the Department of Labor, Amy Loyd, of New Mexico, to be Assistant Secretary for Career, Technical, and Adult Education, Department of Education, Javier Ramirez, of Illinois, to be Federal Mediation and Conciliation Director, Linda A. Puchala, of Maryland, to be Member of the National Mediation Board, andSusan Harthill, of Maryland, to be a Member of the Occupational Safety and Health Review Commission."
117.0,senate,SSHR,2022-01-12,"Business meeting to consider the nominations of Robert McKinnon Califf, of North Carolina, to be Commissioner of Food and Drugs, Department of Health and Human Services, Jose Javier Rodriguez, of Florida, and Lisa M. Gomez, of New Jersey, both to be an Assistant Secretary, and David Weil, of Massachusetts, to be Administrator of the Wage and Hour Division, all of the Department of Labor, Amy Loyd, of New Mexico, to be Assistant Secretary for Career, Technical, and Adult Education, Department of Education, Javier Ramirez, of Illinois, to be Federal Mediation and Conciliation Director, Linda A. Puchala, of Maryland, to be Member of the National Mediation Board, andSusan Harthill, of Maryland, to be a Member of the Occupational Safety and Health Review Commission."
117.0,senate,SSHR,2022-01-11,"Hearings to examine a Federal perspective on the COVID-19 response, focusing onaddressing new variants."
117.0,senate,SSHR,2022-01-05,"Business meeting to consider the nominations of Robert McKinnon Califf, of North Carolina, to be Commissioner of Food and Drugs, Department of Health and Human Services, Jose Javier Rodriguez, of Florida, and Lisa M. Gomez, of New Jersey, both to be an Assistant Secretary, and David Weil, of Massachusetts, to be Administrator of the Wage and Hour Division, all of the Department of Labor, Amy Loyd, of New Mexico, to be Assistant Secretary for Career, Technical, and Adult Education, Department of Education, Javier Ramirez, of Illinois, to be Federal Mediation and Conciliation Director, and Linda A. Puchala, of Maryland, to be Member of the National Mediation Board."
117.0,senate,SSHR,2021-12-14,"Hearings to examine the nomination of Robert McKinnon Califf, of North Carolina, to be Commissioner of Food and Drugs, Department of Health and Human Services."
117.0,senate,SSHR,2021-12-02,"Business meeting to consider the nominations of Lisa M. Gomez, of New Jersey, to be an Assistant Secretary of Labor, James D. Rodriguez, of Texas, to be Assistant Secretary of Labor for Veterans&#39; Employment and Training, Maria Rosario Jackson, of the District of Columbia, to be Chairperson of the National Endowment for the Arts, Shelly C. Lowe, of Arizona, to be Chairperson of the National Endowment for the Humanities, and Susan Harthill, of Maryland, to be a Member of the Occupational Safety and Health Review Commission."
117.0,senate,SSHR,2021-11-30,"Business meeting to consider the nominations of Lisa M. Gomez, of New Jersey, to be an Assistant Secretary of Labor, James D. Rodriguez, of Texas, to be Assistant Secretary of Labor for Veterans&#39; Employment and Training, Maria Rosario Jackson, of the District of Columbia, to be Chairperson of the National Endowment for the Arts, Shelly C. Lowe, of Arizona, to be Chairperson of the National Endowment for the Humanities, and Susan Harthill, of Maryland, to be a Member of the Occupational Safety and Health Review Commission."
117.0,senate,SSHR,2021-11-04,"Hearings to examine the road ahead for the COVID-19 response, focusing on next steps."
117.0,senate,SSHR,2021-10-26,"Business meeting to consider the nominations of Michael D. Smith, of Virginia, to be Chief Executive Officer of the Corporation for National and Community Service, Jose Javier Rodriguez, of Florida, to be an Assistant Secretary, and Larry D. Turner, of North Carolina, to be Inspector General, both of the Department of Labor,Sandra D. Bruce, of Delaware, to be Inspector General, and Amy Loyd, of New Mexico, to be Assistant Secretary for Career, Technical, and Adult Education, both of the Department of Education, and Deirdre Hamilton, of the District of Columbia, Gerald W. Fauth, of Virginia, and Linda A. Puchala, of Maryland, each to be Member of the National Mediation Board."
117.0,senate,SSHR,2021-10-07,"Hearings to examine the nominations of Lisa M. Gomez, of New Jersey, and Jose Javier Rodriguez, of Florida, both to be an Assistant Secretary of Labor."
117.0,senate,SSHR,2021-09-30,"Hearings to examineschool reopening during COVID-19, focusing on supporting students, educators, and families."
117.0,senate,SSHR,2021-09-22,"Hearings to examine successful on the job, apprenticeship training programs to help workers and business get ready to work."
117.0,senate,SSHR,2021-08-03,"Business meeting to consider S.1486, to eliminate discrimination and promote women&#39;s health and economic security by ensuring reasonable workplace accommodations for workers whose ability to perform the functions of a job are limited by pregnancy, childbirth, or a related medical condition, S.1543, to amend the Public Health Service Act to provide best practices on student suicide awareness and prevention training and condition State educational agencies, local educational agencies, and tribal educational agencies receiving funds under section 520A of such Act to establish and implement a school-based student suicide awareness and prevention training policy, S.2425, to amend the Public Health Service Act to ensure the provision of high-quality service through the Suicide Prevention Lifeline, S.2401, to reauthorize the Assistive Technology Act of 1998, the nominations of David Weil, of Massachusetts, to be Administrator of the Wage and Hour Division, Department of Labor, Catherine Elizabeth Lhamon, of California, to be Assistant Secretary for Civil Rights, Department of Education, Javier Ramirez, of Illinois, to be Federal Mediation and Conciliation Director, and other pending calendar business."
117.0,senate,SSHR,2021-08-03,"Business meeting to consider S.1486, to eliminate discrimination and promote women&#39;s health and economic security by ensuring reasonable workplace accommodations for workers whose ability to perform the functions of a job are limited by pregnancy, childbirth, or a related medical condition, S.1543, to amend the Public Health Service Act to provide best practices on student suicide awareness and prevention training and condition State educational agencies, local educational agencies, and tribal educational agencies receiving funds under section 520A of such Act to establish and implement a school-based student suicide awareness and prevention training policy, S.2425, to amend the Public Health Service Act to ensure the provision of high-quality service through the Suicide Prevention Lifeline, S.2401, to reauthorize the Assistive Technology Act of 1998, the nominations of David Weil, of Massachusetts, to be Administrator of the Wage and Hour Division, Department of Labor, Catherine Elizabeth Lhamon, of California, to be Assistant Secretary for Civil Rights, Department of Education, Javier Ramirez, of Illinois, to be Federal Mediation and Conciliation Director, and other pending calendar business."
117.0,senate,SSHR,2021-07-27,"Hearings to examine building on lessons learned from the COVID-19 pandemic, focusing on the path forward."
117.0,senate,SSHR,2021-07-22,"Hearings to examine American workers in a 21st century economy, focusing on the right to organize."
117.0,senate,SSHR,2021-07-21,Hearings to examinedisparities in life expectancy.
117.0,senate,SSHR,2021-07-21,"Business meeting to consider S.1275, to amend the Family Violence Prevention and Services Act to make improvements, and the nominations of Catherine Elizabeth Lhamon, of California, to be Assistant Secretary for Civil Rights, Elizabeth Merrill Brown, of Maryland, to be General Counsel, and Roberto Josue Rodriguez, of the District of Columbia, to be Assistant Secretary for Planning, Evaluation, and Policy Development, all of the Department of Education, David Weil, of Massachusetts, to be Administrator of the Wage and Hour Division, Department of Labor, Gwynne A. Wilcox, of New York, and David M. Prouty, of Maryland, both to be a Member of the National Labor Relations Board, and other pending calendar business."
117.0,senate,SSHR,2021-07-20,"Hearings to examinea Federal perspective on the COVID-19 response, focusing on the path forward."
117.0,senate,SSHR,2021-07-15,"Hearings to examine the nominations of David Weil, of Massachusetts, to be Administrator of the Wage and Hour Division, Department of Labor, and Gwynne A. Wilcox, of New York, and David M. Prouty, of Maryland, both to be a Member of the National Labor Relations Board."
117.0,senate,SSHR,2021-07-13,"Hearings to examine the nominations of Catherine Elizabeth Lhamon, of California, to be Assistant Secretary for Civil Rights, Elizabeth Merrill Brown, of Maryland, to be General Counsel, and Roberto Josue Rodriguez, of the District of Columbia, to be Assistant Secretary for Planning, Evaluation, and Policy Development, all of the Department of Education."
117.0,senate,SSHR,2021-06-22,"Hearings to examinevaccines, focusing on America&#39;s shot at ending the COVID-19 pandemic."
117.0,senate,SSHR,2021-06-17,"Hearings to examineCOVID-19 response and recovery, focusing on supporting the needs of students in higher education and lessons on safely returning to campus."
117.0,senate,SSHR,2021-06-16,"Business meeting to consider the nominations of Gwen Graham, of Florida, to be Assistant Secretary for Legislation and Congressional Affairs, Department of Education, Rajesh D. Nayak, of Maryland, Taryn Mackenzie Williams, of the District of Columbia, and Douglas L. Parker, of West Virginia, each to be an Assistant Secretary of Labor, and Dawn Myers O&#39;Connell, of the District of Columbia, to be Assistant Secretary for Preparedness and Response, and Miriam E. Delphin-Rittmon, of Connecticut, to be Assistant Secretary for Mental Health and Substance Use, both of the Department of Health and Human Services."
117.0,senate,SSHR,2021-06-16,"Business meeting to consider the nominations of Gwen Graham, of Florida, to be Assistant Secretary for Legislation and Congressional Affairs, Department of Education, Rajesh D. Nayak, of Maryland, Taryn Mackenzie Williams, of the District of Columbia, and Douglas L. Parker, of West Virginia, each to be an Assistant Secretary of Labor, and Dawn Myers O&#39;Connell, of the District of Columbia, to be Assistant Secretary for Preparedness and Response, and Miriam E. Delphin-Rittmon, of Connecticut, to be Assistant Secretary for Mental Health and Substance Use, both of the Department of Health and Human Services."
117.0,senate,SSHR,2021-06-10,"Business meeting to consider S.1927, to amend the Child Abuse Prevention and Treatment Act, and other pending calendar business."
117.0,senate,SSHR,2021-06-08,"Hearings to examine the nominations of Dawn Myers O&#39;Connell, of the District of Columbia, to be Assistant Secretary for Preparedness and Response, and Miriam E. Delphin-Rittmon, of Connecticut, to be Assistant Secretary for Mental Health and Substance Use, both of the Department of Health and Human Services."
117.0,senate,SSSB,2022-09-21,An oversight hearing to examine the SBA&#39;s State Trade Expansion Program.
117.0,senate,SSSB,2022-08-02,An oversight hearing to examinethe Small Business Administration&#39;s COVID Economic Injury Disaster Loan program.
117.0,senate,SSSB,2022-07-27,Hearings to examine opportunities and barriers to entrepreneurship for returning citizens and justice impacted individuals.
117.0,senate,SSSB,2022-07-13,An oversight hearing to examine the Small Business Administration&#39;s Office of Disaster Assistance.
117.0,senate,SSSB,2022-06-08,"Hearings to examine the small business workforce challenge, focusing on causes, impacts, and solutions."
117.0,senate,SSSB,2022-05-18,"Business meeting to consider S.1687, to amend section 21 of the Small Business Act to require cyber certification for small business development center counselors, S.2162, to require the Small Business Administration to publish loan default rates by franchise brand, S.3564, to amend the Small Business Act to codify the Boots to Business Program, S.3595, to amend the Small Business Act to require the Small Business and Agriculture Regulatory Enforcement Ombudsman to create a centralized website for compliance guides, and S.3906, to improve certain programs of the Small Business Administration to better assist small business customers in accessing broadband technology."
117.0,senate,SSSB,2022-04-27,An oversight hearing to examine the Small Business Administration.
117.0,senate,SSSB,2022-03-30,Hearings to examinethe supply chain crisis and the implications for small businesses.
117.0,senate,SSSB,2022-03-16,"Hearings to examinesmall business franchising, focusing on an overview of the industry, Small Business Administration&#39;s role, and legislative proposals."
