hearing_congress,hearing_chamber,hearing_committee_id,hearing_date,hearing_description
117.0,senate,SSEV,2022-09-07,"Hearings to examine the nominations of William J. Renick, of Mississippi, Adam Wade White, of Kentucky, and Joe H. Ritch, of Alabama, each to be a Member of the Board of Directors of the Tennessee Valley Authority."
117.0,senate,SSEV,2022-09-07,"Hearings to examine S.2736, to exclude vehicles to be used solely for competition from certain provisions of the Clean Air Act, S.1475, to amend the Clean Air Act to prohibit the issuance of permits under title V of that Act for certain emissions from agricultural production, S.2661, to amend the Clean Air Act to establish a grant program for supporting local communities in detecting, preparing for, communicating about, or mitigating the environmental and public health impacts of wildfire smoke, and S.2421, to authorize the Administrator of the Environmental Protection Agency to conduct research on wildfire smoke."
117.0,senate,SSEV,2022-07-27,"Hearings to examine the development of projects and implementation of policies that support carbon capture, utilization, and storage (CCUS) technologies."
117.0,senate,SSEV,2022-07-27,"Hearings to examine the development of projects and implementation of policies that support carbon capture, utilization, and storage (CCUS) technologies."
117.0,senate,SSEV,2022-07-27,"Business meeting to consider the nominations of Joseph Goffman, of Pennsylvania, to be an Assistant Administrator of the Environmental Protection Agency, Annie Caputo, of Virginia, and Bradley R. Crowell, of Nevada, both to be a Member of the Nuclear Regulatory Commission, and 15 General Services Administration resolutions."
117.0,senate,SSEV,2022-07-20,Business meeting to consider pending calendar business.
117.0,senate,SSEV,2022-07-13,"Hearings to examine S.1345, to establish a national mercury monitoring program, S.2476, to require the Administrator of the Environmental Protection Agency to establish a pilot program for hyperlocal air quality monitoring projects in environmental justice communities, and an original bill entitled, &quot;Public Health Air Quality Act&quot;."
117.0,senate,SSEV,2022-06-22,Hearings to examineToxic Substances Control Act amendments implementation.
117.0,senate,SSEV,2022-06-15,"Hearings to examine S.2194, to authorize the Secretary of the Interior, through the Coastal Program of the United States Fish and Wildlife Service, to work with willing partners and provide support to efforts to assess, protect, restore, and enhance important coastal areas that provide fish and wildlife habitat on which Federal trust species depend, an original bill entitled, &quot;the Strengthening Coastal Communities Act&quot;, S.3069, to reauthorize the Great Lakes Fish and Wildlife Restoration Act of 1990, and S.3767, to amend the Water Infrastructure Improvements for the Nation Act to reauthorize Delaware River Basin conservation programs."
117.0,senate,SSEV,2022-06-09,"Hearings to examine S.4244, to amend the Toxic Substances Control Act to prohibit the manufacture, processing, use, and distribution in commerce of commercial asbestos and mixtures and articles containing commercial asbestos."
117.0,senate,SSEV,2022-06-08,"Hearings to examine the nominations of Annie Caputo, of Virginia, and Bradley R. Crowell, of Nevada, both to be a Member of the Nuclear Regulatory Commission."
117.0,senate,SSEV,2022-05-25,"Hearings to examine the nomination of Joseph Goffman, of Pennsylvania, to be an Assistant Administrator of the Environmental Protection Agency."
117.0,senate,SSEV,2022-05-18,Hearings to examine the President&#39;s proposed budget request for fiscal year 2023 for the Fish and Wildlife Service.
117.0,senate,SSEV,2022-05-11,An oversight hearing to examinethe Council on Environmental Quality.
117.0,senate,SSEV,2022-05-04,"Business meeting to consider an original bill entitled, &quot;Water Resources Development Act&quot;, the nomination of Benny R. Wagner, of Tennessee, to be Inspector General of the Tennessee Valley Authority, and 6 General Services Administration resolutions."
117.0,senate,SSEV,2022-04-07,"Business meeting to consider S.2372, to amend the Pittman-Robertson Wildlife Restoration Act to make supplemental funds available for management of fish and wildlife species of greatest conservation need as determined by State fish and wildlife agencies, S.3742, to establish a pilot grant program to improve recycling accessibility, S.3743, to require the Administrator of the Environmental Protection Agency to carry out certain activities to improve recycling and composting programs in the United States, the nominations of David M. Uhlmann, of Michigan, to be an Assistant Administrator, and Carlton Waterhouse, of Virginia, to be Assistant Administrator, Office of Solid Waste, both of the Environmental Protection Agency, and 11 GSA resolutions."
117.0,senate,SSEV,2022-04-06,"Hearings to examine the nominations of Beth Pritchard Geer, Robert P. Klein, both of Tennessee,and L. Michelle Moore, of Georgia, all to be a Member of the Board of Directors, and Benny R. Wagner, of Tennessee, to be Inspector General, all of the Tennessee Valley Authority."
117.0,senate,SSEV,2022-04-06,Hearings to examine the President&#39;s proposed budget request for fiscal year 2023 for the Environmental Protection Agency.
117.0,senate,SSEV,2022-04-05,"Hearings to examine implementation of the Drinking Water and Wastewater Infrastructure Act, focusing on stakeholders&#39; needs and experiences."
117.0,senate,SSEV,2022-03-23,Hearings to examinepromoting American energy security by facilitating investments and innovation in climate solutions.
117.0,senate,SSEV,2022-03-16,An oversight hearing to examine the Clean Water State Revolving Loan Fund formula.
117.0,senate,SSEV,2022-03-02,An oversight hearing to examineimplementation of the Infrastructure Investment and Jobs Act by the Department of Transportation.
117.0,senate,SSEV,2022-02-16,"Hearings to examine the Environmental Protection Agency&#39;s Renewable Fuel Standard program, focusing on challenges and opportunities."
117.0,senate,SSEV,2022-02-09,"Hearings to examine S.2373, to reestablish United States global leadership in nuclear energy, revitalize domestic nuclear energy supply chain infrastructure, support the licensing of advanced nuclear technologies, and improve the regulation of nuclear energy, and S.1290, to assist communities affected by stranded nuclear waste."
117.0,senate,SSEV,2022-02-02,Hearings to examinelegislative proposals to improve domestic recycling and composting programs.
117.0,senate,SSEV,2022-02-02,Hearings to examinelegislative proposals to improve domestic recycling and composting programs.
117.0,senate,SSEV,2022-01-12,"An oversight hearing to examine the Water Resources Development Act, focusing on USACE implementation of water infrastructure projects, programs, and priorities."
117.0,senate,SSEV,2022-01-12,"Business meeting to consider the nominations of David M. Uhlmann, of Michigan, and Henry Christopher Frey, of North Carolina, both to be an Assistant Administrator of the Environmental Protection Agency, Martha Williams, of Montana, to be Director of the United States Fish and Wildlife Service, Department of the Interior, and 18 GSA resolutions; to be immediately followed byan oversight hearing to examine the Water Resources Development Act, focusing on USACE implementation of water infrastructure projects, programs, and priorities."
117.0,senate,SSEV,2022-01-05,Business meeting to consider 17 GSA resolutions.
117.0,senate,SSEV,2021-12-08,"Hearings to examine S.2372, to amend the Pittman-Robertson Wildlife Restoration Act to make supplemental funds available for management of fish and wildlife species of greatest conservation need as determined by State fish and wildlife agencies."
117.0,senate,SSEV,2021-12-01,An oversight hearing to examine the Nuclear Regulatory Commission.
117.0,senate,SSEV,2021-12-01,"Business meeting to consider H.R.4660, to designate the Federal Building and United States Courthouse located at 1125 Chapline Street in Wheeling, West Virginia, as the &quot;Frederick P. Stamp, Jr. Federal Building and United States Courthouse&quot;, H.R.390, to redesignate the Federal building located at 167 North Main Street in Memphis, Tennessee as the &quot;Odell Horton Federal Building&quot;, S.2938, to designate the United States Courthouse and Federal Building located at 111 North Adams Street in Tallahassee, Florida, as the &quot;Joseph Woodrow Hatchett United States Courthouse and Federal Building&quot;, and the nominations of Carlton Waterhouse, of Virginia, to be Assistant Administrator, Office of Solid Waste, Amanda Howe, of Virginia, David M. Uhlmann, of Michigan, and Henry Christopher Frey, of North Carolina, each to be an Assistant Administrator, all of the Environmental Protection Agency, and Jennifer Clyburn Reed, of South Carolina, to be Federal Cochairperson of the Southeast Crescent Regional Commission, and 4 General Services Administration Resolutions; to be immediately followed byan oversight hearing to examine the Nuclear Regulatory Commission."
117.0,senate,SSEV,2021-11-17,"Hearings to examine the nomination of Martha Williams, of Montana, to be Director of the United States Fish and Wildlife Service, Department of the Interior."
117.0,senate,SSEV,2021-11-03,Hearings to examine programs at the Economic Development Administration.
117.0,senate,SSEV,2021-10-27,"Hearings to examine the nominations of Henry Christopher Frey, of North Carolina, to be an Assistant Administrator of the Environmental Protection Agency, and Jennifer Clyburn Reed, of South Carolina, to be Federal Cochairperson of the Southeast Crescent Regional Commission."
117.0,senate,SSEV,2021-10-20,Hearings to examine evaluating the Federal response to the persistence and impacts of PFAS chemicals on our environment.
117.0,senate,SSEV,2021-10-06,An oversight hearing to examinethe U.S. Army Corps of Engineers emergency response to Hurricane Ida.
117.0,senate,SSEV,2021-09-22,"Business meeting to consider S.2205, to designate the United States courthouse located at 201 South Evans Street in Greenville, North Carolina, as the &quot;Malcolm J. Howard United States Courthouse&quot;, S.2126, to designate the Federal Office Building located at 308 W. 21st Street in Cheyenne, Wyoming, as the &quot;Louisa Swain Federal Office Building&quot;, S.1226, to designate the United States courthouse located at 1501 North 6th Street in Harrisburg, Pennsylvania, as the &quot;Sylvia H. Rambo United States Courthouse&quot;, S.233, to designate the Rocksprings Station of the U.S. Border Patrol located on West Main Street in Rocksprings, Texas, as the &quot;Donna M. Doss Border Patrol Station&quot;, the nominations of Jeffrey M. Prieto, of California, to be an Assistant Administrator of the Environmental Protection Agency, Michael Lee Connor, of Colorado, to be an Assistant Secretary of the Army, Department of Defense, Stephen A. Owens, of Arizona, Jennifer Beth Sass, of Maryland, and Sylvia E. Johnson, of North Carolina, each to be a Member of the Chemical Safety and Hazard Investigation Board, and 9 General Services Administration resolutions; to be immediately followed by a hearing to examinethe circular economy as a concept for creating a more sustainable future."
117.0,senate,SSEV,2021-09-22,"Business meeting to consider S.2205, to designate the United States courthouse located at 201 South Evans Street in Greenville, North Carolina, as the &quot;Malcolm J. Howard United States Courthouse&quot;, S.2126, to designate the Federal Office Building located at 308 W. 21st Street in Cheyenne, Wyoming, as the &quot;Louisa Swain Federal Office Building&quot;, S.1226, to designate the United States courthouse located at 1501 North 6th Street in Harrisburg, Pennsylvania, as the &quot;Sylvia H. Rambo United States Courthouse&quot;, S.233, to designate the Rocksprings Station of the U.S. Border Patrol located on West Main Street in Rocksprings, Texas, as the &quot;Donna M. Doss Border Patrol Station&quot;, the nominations of Jeffrey M. Prieto, of California, to be an Assistant Administrator of the Environmental Protection Agency, Michael Lee Connor, of Colorado, to be an Assistant Secretary of the Army, Department of Defense, Stephen A. Owens, of Arizona, Jennifer Beth Sass, of Maryland, and Sylvia E. Johnson, of North Carolina, each to be a Member of the Chemical Safety and Hazard Investigation Board, and 9 General Services Administration resolutions."
117.0,senate,SSEV,2021-09-15,"Hearings to examine the nominations of Amanda Howe, of Virginia, and David M. Uhlmann, of Michigan, both to be an Assistant Administrator, and Carlton Waterhouse, of Virginia, to be Assistant Administrator, Office of Solid Waste, all of the Environmental Protection Agency."
117.0,senate,SSEV,2021-09-15,"Business meeting to consider S.2205, to designate the United States courthouse located at 201 South Evans Street in Greenville, North Carolina, as the &quot;Malcolm J. Howard United States Courthouse&quot;, S.2126, to designate the Federal Office Building located at 308 W. 21st Street in Cheyenne, Wyoming, as the &quot;Louisa Swain Federal Office Building&quot;, S.1226, to designate the United States courthouse located at 1501 North 6th Street in Harrisburg, Pennsylvania, as the &quot;Sylvia H. Rambo United States Courthouse&quot;, S.233, to designate the Rocksprings Station of the U.S. Border Patrol located on West Main Street in Rocksprings, Texas, as the &quot;Donna M. Doss Border Patrol Station&quot;, the nominations of Jeffrey M. Prieto, of California, to be an Assistant Administrator of the Environmental Protection Agency, Michael Lee Connor, of Colorado, to be an Assistant Secretary of the Army, Department of Defense, Stephen A. Owens, of Arizona, Jennifer Beth Sass, of Maryland, and Sylvia E. Johnson, of North Carolina, each to be a Member of the Chemical Safety and Hazard Investigation Board, and 9 General Services Administration resolutions; to be immediately followed by a hearingto examine the nominations of Amanda Howe, of Virginia, and David M. Uhlmann, of Michigan, both to be an Assistant Administrator, and Carlton Waterhouse, of Virginia, to be Assistant Administrator, Office of Solid Waste, all of the Environmental Protection Agency."
117.0,senate,SSEV,2021-08-11,"Hearings to examine the nominations of Amanda Howe, of Virginia, and David M. Uhlmann, of Michigan, both to be an Assistant Administrator, and Carlton Waterhouse, of Virginia, to be Assistant Administrator, Office of Solid Waste, all of the Environmental Protection Agency."
117.0,senate,SSEV,2021-08-04,"Hearings to examine the nominations of Amanda Howe, of Virginia, and David M. Uhlmann, of Michigan, both to be an Assistant Administrator, and Carlton Waterhouse, of Virginia, to be Assistant Administrator, Office of Solid Waste, all of the Environmental Protection Agency."
117.0,senate,SSEV,2021-08-04,"Business meeting to consider S.2205, to designate the United States courthouse located at 201 South Evans Street in Greenville, North Carolina, as the &quot;Malcolm J. Howard United States Courthouse&quot;, S.2126, to designate the Federal Office Building located at 308 W. 21st Street in Cheyenne, Wyoming, as the &quot;Louisa Swain Federal Office Building&quot;, S.1226, to designate the United States courthouse located at 1501 North 6th Street in Harrisburg, Pennsylvania, as the &quot;Sylvia H. Rambo United States Courthouse&quot;, S.233, to designate the Rocksprings Station of the U.S. Border Patrol located on West Main Street in Rocksprings, Texas, as the &quot;Donna M. Doss Border Patrol Station&quot;, and the nominations of Jeffrey M. Prieto, of California, to be an Assistant Administrator of the Environmental Protection Agency, and Michael Lee Connor, of Colorado, to be an Assistant Secretary of the Army, Department of Defense; to be immediately followed by a hearing to examine the nominations of Amanda Howe, of Virginia, and David M. Uhlmann, of Michigan, both to be an Assistant Administrator, and Carlton Waterhouse, of Virginia, to be Assistant Administrator, Office of Solid Waste, all of the Environmental Protection Agency."
117.0,senate,SSEV,2021-07-29,"Hearings to examine the nominations of Stephen A. Owens, of Arizona, Jennifer Beth Sass, of Maryland, and Sylvia E. Johnson, of North Carolina, each to be a Member of the Chemical Safety and Hazard Investigation Board."
117.0,senate,SSEV,2021-07-28,Hearings to examinethe benefits of investing in U.S. Army Corps of Engineers water infrastructure projects.
117.0,senate,SSEV,2021-07-22,Hearings to examinecurrent issues adversely affecting environmental justice populations.
117.0,senate,SSEV,2021-07-21,Hearings to examine cybersecurity vulnerabilities facing our nation&#39;s physical infrastructure.
117.0,senate,SSEV,2021-07-21,Hearings to examine cybersecurity vulnerabilities facing our nation&#39;s physical infrastructure.
117.0,senate,SSEV,2021-07-14,"Business meeting to consider the nominations of Alejandra Y. Castillo, of New York, to be Assistant Secretary of Commerce for Economic Development, and Jane Toshiko Nishida, of Maryland, to be an Assistant Administrator of the Environmental Protection Agency; to be immediately followed by a hearing to examine the nomination ofMichael Lee Connor, of Colorado, to be an Assistant Secretary of the Army, Department of Defense."
117.0,senate,SSEV,2021-06-24,An oversight hearing to examinethe role of natural and nature-based features in water resources projects.
117.0,senate,SSEV,2021-06-16,"Hearings to examine the nominations of Jeffrey M. Prieto, of California, and Jane Toshiko Nishida, of Maryland, both to be an Assistant Administrator of the Environmental Protection Agency, and Alejandra Y. Castillo, of New York, to be Assistant Secretary of Commerce for Economic Development."
117.0,senate,SSEV,2021-06-09,"Hearings to examinePFAS, focusing on the view from affected citizens and states."
117.0,senate,SSEV,2021-06-09,"Hearings to examinePFAS, focusing on the view from affected citizens and states."
117.0,senate,SSEV,2021-05-26,"Business meeting to consider an original bill entitled, &quot;Surface Transportation Reauthorization Act of 2021&quot;, the nominations of Shannon Aneal Estenoz, of Florida, to be Assistant Secretary for Fish and Wildlife, Department of the Interior, Radhika Fox, of California, to be an Assistant Administrator, and Michal Ilana Freedhoff, of Maryland, to be Assistant Administrator for Toxic Substances, both of the Environmental Protection Agency, and 10 General Services Administration resolutions."
117.0,senate,SSEV,2021-05-19,"Hearings to examine biodiversity loss, focusing on drivers, impacts, and potential solutions."
117.0,senate,SSEV,2021-05-12,"Hearings to examine the nominations of Shannon Aneal Estenoz, of Florida, to be Assistant Secretary of the Interior for Fish and Wildlife, and Radhika Fox, of California, to be an Assistant Administrator and Michal Ilana Freedhoff, of Maryland, to be Assistant Administrator for Toxic Substances, both of the Environmental Protection Agency."
117.0,senate,SSFI,2022-09-07,"Business meeting to consider the nomination of Douglas J. McKalip, of the District of Columbia, to be Chief Agricultural Negotiator, Office of the United States Trade Representative, with the rank of Ambassador."
117.0,senate,SSFI,2022-08-03,Hearings to examine organizational failures of the U.S.&#39;s organ procurement and transplantation network.
117.0,senate,SSFI,2022-07-28,"Hearings to examine the nomination of Douglas J. McKalip, of the District of Columbia, to be Chief Agricultural Negotiator, Office of the United States Trade Representative, with the rank of Ambassador."
117.0,senate,SSFI,2022-07-28,"Business meeting to consider the nominations of Jay Curtis Shambaugh, of Maryland, to be an Under Secretary of the Treasury, and Rebecca Lee Haffajee, of Massachusetts, to be an Assistant Secretary of Health and Human Services; to be immediately followed bya hearing to examine the nomination of Douglas J. McKalip, of the District of Columbia, to be Chief Agricultural Negotiator, Office of the United States Trade Representative, with the rank of Ambassador."
117.0,senate,SSFI,2022-07-20,Hearings to examinethe role of tax incentives in affordable housing.
117.0,senate,SSFI,2022-07-12,"Hearings to examine the nominations of Jay Curtis Shambaugh, of Maryland, to be an Under Secretary of the Treasury, and Rebecca Lee Haffajee, of Massachusetts, to be an Assistant Secretary of Health and Human Services."
117.0,senate,SSFI,2022-06-22,"Business meeting to consideran original bill entitled, &quot;Enhancing American Retirement Now Act&quot;."
117.0,senate,SSFI,2022-06-15,"Hearings to examinesupply chain resiliency, focusing on alleviating backlogs and strengthening long-term security."
117.0,senate,SSFI,2022-06-14,Hearings to examine the impact of &lt;em&gt;South Dakota v. Wayfair&lt;/em&gt; on small businesses and remote sales.
117.0,senate,SSFI,2022-06-07,Hearings to examine the President&#39;s proposed budget request for fiscal year 2023.
117.0,senate,SSFI,2022-05-25,"Hearings to examinesupply chain resiliency, focusing on alleviating backlogs and strengthening long-term security."
117.0,senate,SSFI,2022-05-04,Hearings to examinelaws and enforcement governing the political activities of tax exempt entities.
117.0,senate,SSFI,2022-04-07,"Hearings to examine the IRS, the President&#39;s proposed budget request for fiscal year 2023, and the 2022 filing season."
117.0,senate,SSFI,2022-04-05,Hearings to examine the President&#39;s proposed budget request for fiscal year 2023 for the Department of Health and Human Services.
117.0,senate,SSFI,2022-03-31,Hearings to examine the President&#39;s 2022 trade policy agenda.
117.0,senate,SSFI,2022-03-30,"Hearings to examinebehavioral health care when Americans need it, focusing on ensuring parity and care integration."
117.0,senate,SSFI,2022-03-17,Hearings to examinecharitable giving and trends in the nonprofit sector.
117.0,senate,SSFI,2022-03-16,"Hearings to examineprescription drug price inflation, focusing on the urgent need to lower drug prices in Medicare."
117.0,senate,SSFI,2022-03-15,Hearings to examinethe promise and challenge of strategic trade engagement in the Indo-Pacific region.
117.0,senate,SSFI,2022-03-01,"Business meeting to consider the nominations of Robert Michael Gordon, of the District of Columbia, to be an Assistant Secretary, January Contreras, of Arizona, to be Assistant Secretary for Family Support, and Rebecca E. Jones Gaston, of Oregon, to be Commissioner on Children, Youth, and Families, all of the Department of Health and Human Services."
117.0,senate,SSFI,2022-02-17,Hearings to examineIRS customer service challenges.
117.0,senate,SSFI,2022-02-15,"Hearings to examineprotecting youth mental health, focusing on identifying and addressing barriers to care."
117.0,senate,SSFI,2022-02-09,"Hearings to examine the nominations of Robert Michael Gordon, of the District of Columbia, to be an Assistant Secretary, January Contreras, of Arizona, to be Assistant Secretary for Family Support, and Rebecca E. Jones Gaston, of Oregon, to be Commissioner on Children, Youth, and Families, all of the Department of Health and Human Services, and other pending nominations."
117.0,senate,SSFI,2022-02-08,"Hearings to examineprotecting youth mental health, focusing on an advisory and call to action."
117.0,senate,SSFI,2022-02-02,Hearings to examine the Hospital Insurance Trust Fund and the future of Medicare financing.
117.0,senate,SSFI,2021-12-16,"Business meeting to consider the nomination of Neil Harvey MacBride, of Virginia, to be General Counsel for the Department of the Treasury."
117.0,senate,SSFI,2021-12-08,"Business meeting to consider the nominations of Maria Louise Lago, of New York, to be Under Secretary for International Trade, and Lisa W. Wang, of the District of Columbia, to be an Assistant Secretary, both of the Department of Commerce."
117.0,senate,SSFI,2021-12-07,"Hearings to examine promoting competition, growth, and privacy protection in the technology sector."
117.0,senate,SSFI,2021-11-17,"Business meeting to consider the nominations of Maria L. Pagan, of Puerto Rico, to be a Deputy United States Trade Representative (Geneva Office), with the rank of Ambassador, Brent Neiman, of Illinois, to be a Deputy Under Secretary, and Joshua Frost, of New York, to be an Assistant Secretary, both of the Department of the Treasury, Samuel R. Bagenstos, of Michigan, to be General Counsel, and Christi A. Grimm, of Colorado, to be Inspector General, both of the Department of Health and Human Services, and Christopher S. Wilson, of the District of Columbia, to be Chief Innovation and Intellectual Property Negotiator, Office of the United States Trade Representative, with the rank of Ambassador."
117.0,senate,SSFI,2021-11-16,"Hearings to examine the nominations of Lisa W. Wang, of the District of Columbia, to be an Assistant Secretary, and Maria Louise Lago, of New York, to be Under Secretary for International Trade, both of the Department of Commerce."
117.0,senate,SSFI,2021-11-03,"Business meeting to consider the nomination of Chris Magnus, of Arizona, to be Commissioner of U.S. Customs and Border Protection, Department of Homeland Security."
