hearing_congress,hearing_chamber,hearing_committee_id,hearing_date,hearing_description
116.0,senate,SSFR,2020-01-15,"Business meeting to consider H.R.5430, to implement the Agreement between the United States of America, the United Mexican States, and Canada attached as an Annex to the Protocol Replacing the North American Free Trade Agreement, the nominations of Todd C. Chapman, of Texas, to be Ambassador to the Federative Republic of Brazil, John Hennessey-Niland, of Illinois, to be Ambassador to the Republic of Palau, Dorothy Shea, of North Carolina, to be Ambassador to the Lebanese Republic, and Donald Wright, of Virginia, to be Ambassador to the United Republic of Tanzania, all of the Department of State, and other pending calendar business."
116.0,senate,SSFR,2019-12-18,"Business meeting to consider S.482, to strengthen the North Atlantic Treaty Organization, to combat international cybercrime, and to impose additional sanctions with respect to the Russian Federation, and other pending calendar business."
116.0,senate,SSFR,2019-12-17,"Hearings to examine the nomination of Todd C. Chapman, of Texas, to be Ambassador to the Federative Republic of Brazil, Department of State, and other pending nominations."
116.0,senate,SSFR,2019-12-12,Business meeting to consider pending calendar business.
116.0,senate,SSFR,2019-12-11,"Business meeting to consider S.2641, to promote United States national security and prevent the resurgence of ISIS, S.2547, to state the policy of the United States with respect to the expansion of cooperation with allies and partners in the Indo-Pacific region and Europe regarding the People&#39;s Republic of China, S.2977, to extend the termination of sanctions with respect to Venezuela under the Venezuela Defense of Human Rights and Civil Society Act of 2014, S.1310, to strengthen participation of elected national legislators in the activities of the Organization of American States and reaffirm United States support for Organization of American States human rights and anti-corruption initiatives, S.1830, to enhance the security of the United States and its allies, S.704, to prioritize the efforts of and enhance coordination among United States agencies to encourage countries in Central and Eastern Europe to diversify their energy sources and supply routes, increase Europe&#39;s energy security, and help the United States reach its global energy security goals, S.1189, to require the Secretary of State to determine whether the Russian Federation should be designated as a state sponsor of terrorism and whether Russian-sponsored armed entities in Ukraine should be designated as foreign terrorist organizations, S.482, to strengthen the North Atlantic Treaty Organization, to combat international cybercrime, and to impose additional sanctions with respect to the Russian Federation, S.J.Res.4, requiring the advice and consent of the Senate or an Act of Congress to suspend, terminate, or withdraw the United States from the North Atlantic Treaty and authorizing related litigation, S.Con.Res.23, honoring the 75th Anniversary of the Battle of the Bulge fought during World War II, recognizing the valiant efforts of the Allied Forces in December 1944, and remembering those who made the ultimate sacrifice, all of which contributed to the Allied victory in the European Theater,S.Res.142, condemning the Government of the Philippines for its continued detention of Senator Leila De Lima, calling for her immediate release, S.Res.152, expressing the importance of the United States alliance with the Republic of Korea and the contributions of Korean Americans in the United States, S.Res.260, recognizing the importance of sustained United States leadership to accelerating global progress against maternal and child malnutrition and supporting the commitment of the United States Agency for International Development to global nutrition through the Multi-Sectoral Nutrition Strategy, S.Res.297, commending the Inter-American Foundation (IAF) on the occasion of its 50th anniversary for its significant accomplishments and contributions to the economic and social development of the Americas, S.Res.343, congratulating the people of the Czech Republic and the people of the Slovak Republic on the 30th anniversary of the Velvet Revolution, the 26th anniversary of the formation of the Czech Republic and the Slovak Republic, and the 101st anniversary of the declaration of independence of Czechoslovakia,S.Res.371, reaffirming the support of the United States for the people of the Republic of South Sudan and calling on all parties to uphold their commitments to peace and dialogue as outlined in the 2018 revitalized peace agreement, S.Res.374, expressing support for the designation of October 23, 2019, as a national day of remembrance of the tragic terrorist bombing of the United States Marine Corps barracks in Beirut, Lebanon, in 1983, S.Res.375, recognizing the 75th anniversary of the Warsaw Uprising, S.Res.385, celebrating the 30th anniversary of the fall of the Berlin Wall, the reunification of both Germany and Europe, and the spread of democracy around the world, S.Res.395, recognizing the 40th anniversary of the Iran Hostage Crisis, H.R.2744, to authorize the Administrator of the United States Agency for International Development to prescribe the manner in which programs of the agency are identified overseas, H.R.133, to promote economic partnership and cooperation between the United States and Mexico, an original resolution expressing serious concern about widespread irregularities in Bolivia&#39;s October 20, 2019, general elections and supporting the convening of new elections in Bolivia at the earliest possible date, the nominations of Sung Y. Kim, of California, to be Ambassador to the Republic of Indonesia, and Stephen E. Biegun, of Michigan, to be Deputy Secretary, both of the Department of State, and other pending calendar business."
116.0,senate,SSFR,2019-12-05,"Hearings to examine illicit mining, focusing on threats to United States national security and international human rights."
116.0,senate,SSFR,2019-12-04,"Hearings to examineLebanon and Iraq protests, focusing on insights, implications, and objectives for United States policy."
116.0,senate,SSFR,2019-12-04,An oversight hearing to examine the Millennium Challenge Corporation.
116.0,senate,SSFR,2019-12-03,Hearings to examine the future of United States policy towards Russia.
116.0,senate,SSFR,2019-11-20,Hearings to examine challenges and opportunities for advancing United States interests in the United Nations system.
116.0,senate,SSFR,2019-11-20,"Business meeting to consider the nominations of Roxanne Cabral, of Virginia, to be Ambassador to the Republic of the Marshall Islands, Carmen G. Cantor, of Puerto Rico, to be Ambassador to the Federated States of Micronesia, Kelley Eckels Currie, of Georgia, to be Ambassador at Large for Global Women&#39;s Issues, Kelly C. Degnan, of California, to be Ambassador to Georgia, Michael George DeSombre, of Illinois, to be Ambassador to the Kingdom of Thailand, David T. Fischer, of Michigan, to be Ambassador to the Kingdom of Morocco, Robert S. Gilchrist, of Florida, to be Ambassador to the Republic of Lithuania, Peter M. Haymond, of Virginia, to be Ambassador to the Lao People&#39;s Democratic Republic, Sung Y. Kim, of California, to be Ambassador to the Republic of Indonesia, Yuri Kim, of Guam, to be Ambassador to the Republic of Albania, Alina L. Romanowski, of Illinois, to be Ambassador to the State of Kuwait, John Joseph Sullivan, of Maryland, to be Ambassador to the Russian Federation, Morse H. Tan, of Illinois, to be Ambassador at Large for Global Criminal Justice, and Leslie Meredith Tsou, of Virginia, to be Ambassador to the Sultanate of Oman, all of the Department of State, Andeliz N. Castillo, of New York, to be United States Alternate Executive Director of the Inter-American Development Bank, Alma L. Golden, of Texas, to be an Assistant Administrator of the United States Agency for International Development, and routine lists in the Foreign Service."
116.0,senate,SSFR,2019-11-20,"Hearings to examine the nomination of Stephen E. Biegun, of Michigan, to be Deputy Secretary of State."
116.0,senate,SSFR,2019-11-07,"To receive a closed briefing on Afghanistan, focusing on the way ahead."
116.0,senate,SSFR,2019-10-31,"Hearings to examine the nominations of Andeliz N. Castillo, of New York, to be United States Alternate Executive Director of the Inter-American Development Bank, Alma L. Golden, of Texas, to be an Assistant Administrator of the United States Agency for International Development, and Peter M. Haymond, of Virginia, to be Ambassador to the Lao People&#39;s Democratic Republic, Alina L. Romanowski, of Illinois, to be Ambassador to the State of Kuwait, and Leslie Meredith Tsou, of Virginia, to be Ambassador to the Sultanate of Oman, all of the Department of State."
116.0,senate,SSFR,2019-10-30,"Hearings to examine the nomination of John Joseph Sullivan, of Maryland, to be Ambassador to the Russian Federation, Department of State."
116.0,senate,SSFR,2019-10-29,"Hearings to examine the nominations of Roxanne Cabral, of Virginia, to be Ambassador to the Republic of the Marshall Islands, Kelly C. Degnan, of California, to be Ambassador to Georgia, Robert S. Gilchrist, of Florida, to be Ambassador to the Republic of Lithuania, and Yuri Kim, of Guam, to be Ambassador to the Republic of Albania, all of the Department of State."
116.0,senate,SSFR,2019-10-23,Hearings to examine successes and unfinished business in the Western Balkans.
116.0,senate,SSFR,2019-10-22,Hearings to examine the impact of Turkey&#39;s offensive in northeast Syria.
116.0,senate,SSFR,2019-10-16,Hearings to examine pending nominations.
116.0,senate,SSFR,2019-10-16,"Hearings to examine the nominations of Carmen G. Cantor, of Puerto Rico, to be Ambassador to the Federated States of Micronesia, Michael George DeSombre, of Illinois, to be Ambassador to the Kingdom of Thailand, Sung Y. Kim, of California, to be Ambassador to the Republic of Indonesia, Morse H. Tan, of Illinois, to be Ambassador at Large for Global Criminal Justice, and Kelley Eckels Currie, of Georgia, to be Ambassador at Large for Global Women&#39;s Issues, all of the Department of State, and other pending nominations; to be immediately followed by aSubcommittee on East Asia, the Pacific, and International Cybersecurity Policy hearing to examine the Asia Reassurance Initiative Act in action, focusing on implementation and the Indo-Pacific strategy."
116.0,senate,SSFR,2019-10-16,Hearings to examine United States-Iran policy.
116.0,senate,SSFR,2019-09-26,"Hearings to examine the Hong Kong emergency, focusing on securing freedom, autonomy, and human rights."
116.0,senate,SSFR,2019-09-25,"Business meeting to consider S.1590, to amend the State Department Basic Authorities Act of 1956 to authorize rewards for thwarting wildlife trafficking linked to transnational organized crime, S.1678, to express United States support for Taiwan&#39;s diplomatic alliances around the world, S.1838, to amend the Hong Kong Policy Act of 1992, S.2372, to enhance global engagement to combat marine debris, S.2503, to reauthorize the United States Commission on International Religious Freedom, S.Res.183, reaffirming the vital role of the United States-Japan alliance in promoting peace, stability, and prosperity in the Indo-Pacific region and beyond, S.Res.236, reaffirming the strong partnership between Tunisia and the United States and supporting the people of Tunisia in their continued pursuit of democratic reforms, S.Res.277, remembering the 25th Anniversary of the bombing of the Argentine Israelite Mutual Association (AMIA) Jewish Community Center in Buenos Aires, Argentina, and recommitting to efforts to uphold justice for the 85 victims of the attacks, an original resolutionto support the Global Fund to fight AIDS, Tuberculosis and Malaria, and the Sixth Replenishment, and other pending calendar business."
116.0,senate,SSFR,2019-09-25,"Business meeting to consider S.1590, to amend the State Department Basic Authorities Act of 1956 to authorize rewards for thwarting wildlife trafficking linked to transnational organized crime, S.1678, to express United States support for Taiwan&#39;s diplomatic alliances around the world, S.1838, to amend the Hong Kong Policy Act of 1992, S.2372, to enhance global engagement to combat marine debris, S.2503, to reauthorize the United States Commission on International Religious Freedom, S.Res.183, reaffirming the vital role of the United States-Japan alliance in promoting peace, stability, and prosperity in the Indo-Pacific region and beyond, S.Res.236, reaffirming the strong partnership between Tunisia and the United States and supporting the people of Tunisia in their continued pursuit of democratic reforms, S.Res.277, remembering the 25th Anniversary of the bombing of the Argentine Israelite Mutual Association (AMIA) Jewish Community Center in Buenos Aires, Argentina, and recommitting to efforts to uphold justice for the 85 victims of the attacks, S.Res.318, to support the Global Fund to fight AIDS, Tuberculosis and Malaria, and the Sixth Replenishment, and other pending calendar business."
116.0,senate,SSFR,2019-09-25,"Hearings to examineUnited States policy in Mexico and Central America, focusing on ensuring effective policies to address the crisis at the border."
116.0,senate,SSHR,2020-09-23,"Hearings to examine COVID-19, focusing on an update on the federal response."
116.0,senate,SSHR,2020-09-17,Hearings to examinefixing theFree Application for Federal Student Aid.
116.0,senate,SSHR,2020-09-15,"Hearings to examinecompensating college athletes, focusing on the potential impact on athletes and institutions."
116.0,senate,SSHR,2020-09-09,"Hearings to examine vaccines, focusing on saving lives, ensuring confidence, and protecting public health."
116.0,senate,SSHR,2020-09-09,"Hearings to examine vaccines, focusing on saving lives, ensuring confidence, and protecting public health."
116.0,senate,SSHR,2020-06-30,"Hearings to examineCOVID-19, focusing on an update on progress toward safely getting back to work and back to school."
116.0,senate,SSHR,2020-06-23,"Hearings to examineCOVID-19, focusing on lessons learned to prepare for the next pandemic."
116.0,senate,SSHR,2020-06-17,"Hearings to examine telehealth, focusing on lessons learned from the COVID-19 pandemic."
116.0,senate,SSHR,2020-06-10,"Hearings to examineCOVID-19, focusing on going back to school safely."
116.0,senate,SSHR,2020-06-04,"Hearings to examineCOVID-19, focusing on going back to college safely."
116.0,senate,SSHR,2020-06-03,"Business meeting to consider the nominations of Keith E. Sonderling, of Florida, Andrea R. Lucas, of Virginia, and Jocelyn Samuels, of Maryland, each to be a Member of the Equal Employment Opportunity Commission, Marvin Kaplan, of Kansas, and Lauren McGarity McFerran, of the District of Columbia, both to be a Member of the National Labor Relations Board, Sethuraman Panchanathan, of Arizona, to be Director of the National Science Foundation, Julie Elizabeth Hocker, of Pennsylvania, to be an Assistant Secretary of Labor, and Richard Giacolone, of Virginia, to be Federal Mediation and Conciliation Director."
116.0,senate,SSHR,2020-05-12,"Hearings to examineCOVID-19, focusing on safely getting back to work and back to school."
116.0,senate,SSHR,2020-05-07,Hearings to examine new tests for COVID-19.
116.0,senate,SSHR,2020-03-18,"Hearings to examine an emerging disease threat, focusing on how the U.S. is responding to COVID-19, the novel coronavirus, part 2."
116.0,senate,SSHR,2020-03-03,"Hearings to examine an emerging disease threat, focusing on how the United States is responding to COVID-19, the Novel Coronavirus."
116.0,senate,SSHR,2020-01-15,"Business meeting to consider H.R.5430, to implement the Agreement between the United States of America, the United Mexican States, and Canada attached as an Annex to the Protocol Replacing the North American Free Trade Agreement."
116.0,senate,SSHR,2019-12-12,"Business meeting to consider S.2971, to amend and reauthorize the Child Abuse Prevention and Treatment Act, S.2683, to establish a task force to assist States in implementing hiring requirements for child care staff members to improve child safety, S.2927, to amend the Public Health Service Act to provide that the authority of the Director of the National Institute on Minority Health and Health Disparities to make certain research endowments applies with respect to both current and former centers of excellence, an original bill entitled, &quot;Title VII Reauthorization&quot;, and the nomination of Crosby Kemper III, of Missouri, to be Director of the Institute of Museum and Library Services."
116.0,senate,SSHR,2019-12-03,"Business meeting to consider the nominations of Stephen Hahn, of Texas, to be Commissioner of Food and Drugs, Department of Health and Human Services, Richard Giacolone, of Virginia, to be Federal Mediation and Conciliation Director, and Cynthia L. Attwood, of Virginia, and Amanda Wood Laihow, of Maine, both to be a Member of Occupational Safety and Health Review Commission."
116.0,senate,SSHR,2019-11-20,"Hearings to examine the nomination of Stephen Hahn, of Texas, to be Commissioner of Food and Drugs, Department of Health and Human Services."
116.0,senate,SSHR,2019-11-13,Hearings to examine the response to lung illnesses and rising youth electronic cigarette use.
116.0,senate,SSHR,2019-10-31,"Business meeting to consider S.1657, to provide assistance to combat the escalating burden of Lyme disease and other tick and vector-borne diseases and disorders, S.2619, to amend the Public Health Service Act to reauthorize the Healthy Start program, S.1399, to amend title VIII of the Public Health Services Act to revise and extend nursing workforce development programs, S.995, to amend title XXIX of the Public Health Service Act to reauthorize the program under such title relating to lifespan respite care, S.1130, to amend the Public Health Service Act to improve the health of children and help better understand and enhance awareness about unexpected sudden death in early life, S.1608, to provide for the publication by the Secretary of Health and Human Services of physical activity recommendations for Americans, S.2629, to amend the Public Health Service Act with respect to the Public Health Service Corps, and an original bill entitled, &quot;Over-the-Counter Drug Safety, Innovation, and Reform Act of 2019&quot;."
116.0,senate,SSHR,2019-09-24,"Business meeting to consider the nomination of Eugene Scalia, of Virginia, to be Secretary of Labor."
116.0,senate,SSHR,2019-09-19,"Hearings to examine the nomination of Eugene Scalia, of Virginia, to be Secretary of Labor."
116.0,senate,SSHR,2019-07-30,"Business meeting to consider the nominations of Sharon Fast Gustafson, of Virginia, to be General Counsel, and Charlotte A. Burrows, of the District of Columbia, to be a Member, both of the Equal Employment Opportunity Commission."
116.0,senate,SSHR,2019-07-30,"Business meeting to consider the nominations of Sharon Fast Gustafson, of Virginia, to be General Counsel, and Charlotte A. Burrows, of the District of Columbia, to be a Member, both of the Equal Employment Opportunity Commission."
116.0,senate,SSHR,2019-06-26,"Business meeting to consider S.1199, to amend the Public Health Service Act to revise and extend the poison center network program, S.1173, to amend the Public Health Service Act to reauthorize the Emergency Medical Services for Children program, S.1895, to lower health care costs, and pending nominations."
116.0,senate,SSHR,2019-06-18,Hearings to examine the Lower Health Care Costs Act.
116.0,senate,SSHR,2019-05-07,"Hearings to examine implementing the 21st Century Cures Act, focusing on making electronic health information available to patients and providers, part II."
116.0,senate,SSHR,2019-04-10,"Hearings to examine reauthorizing the Higher Education Act, focusing on strengthening accountability to protect students and taxpayers."
116.0,senate,SSHR,2019-04-09,"Business meeting to consider the nomination of Gordon Hartogensis, of Connecticut, to be Director of the Pension Benefit Guaranty Corporation for a term of five years, and other pending nominations."
116.0,senate,SSHR,2019-04-02,"Hearings to examine reauthorizing HEA, focusing on addressing campus sexual assault and ensuring student safety and rights."
116.0,senate,SSHR,2019-03-26,"Hearings to examine implementing the 21st Century Cures Act, focusing on making electronic health information available to patients and providers."
116.0,senate,SSHR,2019-03-12,"Hearings to examine reauthorizing the Higher Education Act, focusing on simplifying theFree Application for Federal Student Aid and reducing the burden of verification."
116.0,senate,SSHR,2019-03-05,"Hearings to examine vaccines, focusing on preventable disease outbreaks."
116.0,senate,SSHR,2019-02-27,"Business meeting to consider the nominations of William Beach, of Kansas, to be Commissioner of Labor Statistics, Scott A. Mugno, of Pennsylvania, and John P. Pallasch, of Kentucky, both to be an Assistant Secretary, Cheryl Marie Stanton, of South Carolina, to be Administrator of the Wage and Hour Division, and John Lowry III, of Illinois, to be Assistant Secretary for Veterans&#39; Employment and Training, all of the Department of Labor, Robert L. King, of Kentucky, to be Assistant Secretary for Postsecondary Education, Department of Education, Janet Dhillon, of Pennsylvania, to be a Member of the Equal Employment Opportunity Commission, Mary Anne Carter, of Tennessee, to be Chairperson of the National Endowment for the Arts, Marco M. Rajkovich, Jr., of Kentucky, William I. Althen, of Virginia, and Arthur R. Traynor III, of the District of Columbia, each to be a Member of the Federal Mine Safety and Health Review Commission, and other pending nominations."
116.0,senate,SSHR,2019-02-26,Hearings to examine drug pricing in America.
116.0,senate,SSHR,2019-02-12,Hearings to examine managing pain during the opioid crisis.
116.0,senate,SSHR,2019-02-06,"Business meeting to consider the nominations of William Beach, of Kansas, to be Commissioner of Labor Statistics, Scott A. Mugno, of Pennsylvania, and John P. Pallasch, of Kentucky, both to be an Assistant Secretary, and Cheryl Marie Stanton, of South Carolina, to be Administrator of the Wage and Hour Division, all of the Department of Labor, Mary Anne Carter, of Tennessee, to be Chairperson of the National Endowment for the Arts, Robert L. King, of Kentucky, to be Assistant Secretary for Postsecondary Education, Department of Education, and other pending nominations."
116.0,senate,SSHR,2019-02-05,Hearings to examine how primary care affects health care costs and outcomes.
116.0,senate,SSHR,2019-01-29,"Hearings to examine access to care, focusing on health centers and providers in underserved communities."
116.0,senate,SSGA,2020-12-16,Hearings to examineirregularities in the 2020 election.
116.0,senate,SSGA,2020-12-10,"Hearings to examine combatting the opioid crisis, focusing on oversight of the implementation of the STOP Act."
116.0,senate,SSGA,2020-12-10,"Hearings to examine combatting the opioid crisis, focusing on oversight of the implementation of the STOP Act."
116.0,senate,SSGA,2020-12-08,"Hearings to examine an essential part of a COVID-19 solution, focusing on early outpatient treatment."
116.0,senate,SSGA,2020-12-08,"Hearings to examine an essential part of a COVID-19 solution, focusing on early outpatient treatment."
116.0,senate,SSGA,2020-12-03,"Hearings to examine Congressional oversight in the face of Executive Branch and media suppression, focusing on the case study of Crossfire Hurricane."
116.0,senate,SSGA,2020-12-03,"Hearings to examine Congressional oversight, focusing on a case study of Crossfire Hurricane."
116.0,senate,SSGA,2020-12-02,"Hearings to examine state and local cybersecurity, focusing on defending our communities from cyber threats amid COVID-19."
116.0,senate,SSGA,2020-12-02,"Hearings to examine COVID-19, focusing on vaccine safety and distribution."
116.0,senate,SSGA,2020-12-01,"Hearings to examine COVID-19, focusing on essential components of a solution."
116.0,senate,SSGA,2020-11-19,"Hearings to examine an essential part of a COVID-19 solution, focusing on an early at home treatment."
116.0,senate,SSGA,2020-11-19,"Hearings to examine an essential part of a COVID-19 solution, focusing on an early at home treatment."
116.0,senate,SSGA,2020-11-18,"Hearings to examinemodernizing Federal telework, focusing on moving forward using the lessons learned during the COVID-19 pandemic."
116.0,senate,SSGA,2020-09-30,"Business meeting to consider the nomination of Chad F. Wolf, of Virginia, to be Secretary of Homeland Security."
116.0,senate,SSGA,2020-09-24,Hearings to examinethreats to the homeland.
116.0,senate,SSGA,2020-09-23,"Hearings to examine the nomination of Chad F. Wolf, of Virginia, to be Secretary of Homeland Security."
116.0,senate,SSGA,2020-09-22,"Hearings to examinestate and local cybersecurity, focusing on defending communities from cyber threats amid COVID-19."
